Word	Freq	Count	Epitran	CharSiu	XPF	WikiPron
ясiуагъэх	42.51519918370818	2		j aː s i w aː ʁ a x		
комиссиеми	42.51519918370818	2		kʷ a m ə j s ə j a m ə j		
щытегущыiэхэ	42.51519918370818	2		ɕ ə t a j ɡʷ ɕ ə j a x a		
шъхьаихыгъэу	42.51519918370818	2		ʂ ħ aː j ə x ə ʁ a w		
къыщысiогъагъэх	42.51519918370818	2		q ə ɕ ə s j a ʁ aː ʁ a x		
къэсiуагъэмэ	42.51519918370818	2		q a s ɥ aː ʁ a m a		
ащыщыбэхэр	42.51519918370818	2		aː ɕ ə ɕ ə b a x a r		
зэхэзгъэуцуагъэмэ	42.51519918370818	2		z a x a z ʁ a w t͡sʷ aː ʁ a m a		
къыдалъытагъэх	42.51519918370818	2		q ə d aː ɬ ə t aː ʁ a x		
зэрагъэтэрэзыжьыгъэм	42.51519918370818	2		z a r aː ʁ a t a r a z ə ʑ ə ʁ a m		
сезэгъыгъ	42.51519918370818	2		s a j z a ʁ ə ʁ		
тиадыгэ	42.51519918370818	2		t ə j aː d ə ɡ a		
изытеткiэ	63.772798775562265	3		j ə z ə t a j t kʲ j a		
бырсырым	42.51519918370818	2		b ə r s ə r ə m		
зэхагъэуцогъэ	42.51519918370818	2		z a x aː ʁ a w t͡sʷ a ʁ a		
къыхаутыгъэу	63.772798775562265	3		q ə x aː w t ə ʁ a w		
хъунэу	127.54559755112453	6		χʷ ə n a w		
зытегущыiэхэрэр	42.51519918370818	2		z ə t a j ɡʷ ɕ ə j a x a r a r		
штэгъэным	42.51519918370818	2		ʃ t a ʁ a n ə m		
сэлъытэ	42.51519918370818	2		s a ɬ ə t a		
сигущыiэ	42.51519918370818	2		s ə ɡʷ ə ɕ ə j a		
икiэухым	63.772798775562265	3		j ə kʲ a w x ə m		
къыхаутыгъэ	42.51519918370818	2		q ə x aː w t ə ʁ a		
статья	106.28799795927044	5		s t aː tʲ j a		
зытiу	42.51519918370818	2		z ə t i w		
горэм	191.31839632668678	9		ɡʷ a r a m		
къащатхырэм	42.51519918370818	2		q aː ɕ aː t x ə r a m		
сакъыщыуцу	42.51519918370818	2		s aː q ə ɕ ə w t͡sʷ		
сшiоигъу	42.51519918370818	2		ʃ ʃʷ ə j ə ʁʷ		
апэрэмкiэ	42.51519918370818	2		aː p a r a m kʲ j a		
казбек	276.34879469410316	13		k aː z b a j k		
истатьяу	85.03039836741635	4		j ə s t aː tʲ j a w		
iофгъошхомэ	42.51519918370818	2		j a w f ʁʷ a ʃ xʷ a m a		
зыфиiоу	191.31839632668678	9		z ə f ə j j ʊ		
маим	63.772798775562265	3		m aː j ə m		
къихьагъэр	85.03039836741635	4		q ə j ħ aː ʁ a r		
къызтегущыiэрэ	42.51519918370818	2		q ə z t a j ɡʷ ə ɕ ə j a r a		
iофыгъошхом	42.51519918370818	2		j a f ə ʁʷ a ʃ xʷ a m		
имыфэшъуашэу	42.51519918370818	2		j ə m ə f a ʃʷ aː ʃ a w		
дысэу	42.51519918370818	2		d ə s a w		
гуаоу	42.51519918370818	2		ɡʷ aː w a w		
мыхъунхэр	42.51519918370818	2		m ə χʷ ə n x a r		
риiуалiэу	42.51519918370818	2		r ə j j w aː l j a w		
къыхэкiы	63.772798775562265	3		q ə x a k j ə		
мырэущтэу	85.03039836741635	4		m ə r a w ɕ t a w		
етхы	42.51519918370818	2		j a t x ə		
буквэхэм	42.51519918370818	2		bʷ ə k v a x a m		
ацiэ	63.772798775562265	3		aː t͡s j a		
зыщызэхагъэкiокiэгъэ	42.51519918370818	2		z ə ɕ ə z a x aː ʁ a kʷ a kʷ a ʁ a ʁ a		
ребгъэджэнхэ	42.51519918370818	2		r a j b ʁ a d͡ʒ a n x a		
плъэкiыщтэп	85.03039836741635	4		p ɬ a k j ə ɕ t a p		
рыбгъэсэхъуджэнхэ	42.51519918370818	2		r ə b ʁ a s a χʷ ə d͡ʒ a n x a		
плъэкiыщт	148.8031971429786	7		p ɬ a k j ə ɕ t		
мыщ	467.6671910207899	22		m ə ɕ		
гущыiэ	233.83359551039496	11		ɡʷ ə ɕ ə j a		
мыщыухэр	42.51519918370818	2		m ə ɕ ə w x a r		
пiонри	42.51519918370818	2		p i w a n r ə j		
птхынри	85.03039836741635	4		p t x ə n r ə j		
къекiурэп	42.51519918370818	2		q a j kʷ ə r a p		
ямылажьэр	42.51519918370818	2		j aː m ə l aː ʑ a r		
ялэжьэ	42.51519918370818	2		j aː l a ʑ a		
щытми	42.51519918370818	2		ɕ ə t m ə j		
бырсырми	42.51519918370818	2		b ə r s ə r m ə		
даурми	42.51519918370818	2		d aː w ə r m ə j		
шъаокъоми	42.51519918370818	2		ʂ aː w a qʷ a m ə j		
букви	42.51519918370818	2		bʷ ə k v ə j		
макъи	42.51519918370818	2		m aː q ə j		
зэхагъэкiуакiэрэп	42.51519918370818	2		z a x aː ʁ a kʷ ə aː kʲ a r a p		
зытетым	42.51519918370818	2		z ə t a j t ə m		
къатхы	42.51519918370818	2		q aː t x ə		
буквэу	85.03039836741635	4		bʷ ə k v a w		
'-р	212.57599591854088	10		aː r		
хагъэкiуакiэу	42.51519918370818	2		x aː ʁ a kʷ ə aː kʲ j a w		
еiошъ	42.51519918370818	2		j a j w a ʂ		
хъутым	42.51519918370818	2		χʷ ə t ə m		
егъэмысэх	42.51519918370818	2		j a ʁ a m ə s a x		
зэхэгъэкiокiэгъэ	42.51519918370818	2		z a x a ʁ a kʷʷ a kʲ a ʁ a		
хэтлъагъорэп	42.51519918370818	2		x a t͡ɬ aː ʁʷ a r a p		
тыкъызтегущыiэрэм	42.51519918370818	2		t ə q ə z t a j ɡʷ ə ɕ ə j a r a m		
мары	106.28799795927044	5		m aː r ə		
щатхырэр	42.51519918370818	2		ɕ aː t x ə r a r		
буквэхэу	127.54559755112453	6		bʷ ə k v a x a w		
дд	85.03039836741635	4		d ə d		
зэгъусэхэу	106.28799795927044	5		z a ʁʷ ə s a x a w		
атхы	127.54559755112453	6		aː t x ə		
д-кiэ	42.51519918370818	2		d a k j a		
къегъэжьэгъэ	42.51519918370818	2		q a j ʁ a ʑ a ʁ a		
гущыiэпкъым	42.51519918370818	2		ɡʷ ə ɕ ə j a p q ə m		
иапэрэшъхьэ	85.03039836741635	4		j aː p a r a ʂ ħ a		
къэзгъэлъэгъорэ	127.54559755112453	6		q a z ʁ a ɬ a ʁʷ a r a		
приставкэр	85.03039836741635	4		p r ə j s t aː v k a r		
зыгуахьэкiэ	42.51519918370818	2		z ə ɡʷ aː ħ a kʲ a		
щысэхэр	106.28799795927044	5		ɕ ə s a x a r		
къыд-дэкiон	42.51519918370818	2		q ə d d a kʷ a n		
къыд-дэiэпэiэн	42.51519918370818	2		q ə d d a j a p a j a n		
къыд-дихьан	42.51519918370818	2		q ə d d ə j ħ aː n		
зыфиiохэрэм	212.57599591854088	10		z ə f ə j ɥ a x a r a m		
апэкiэ	106.28799795927044	5		aː p a kʲ j a		
д-дзын	42.51519918370818	2		d͡z ə n		
хэд-дзэн	42.51519918370818	2		x a d͡z a n		
д-джын	42.51519918370818	2		d͡ʒ ə n		
диал	42.51519918370818	2		d ə j aː l		
'ты-дзын	42.51519918370818	2		t ə d͡z ə n		
хэты-дзэн	42.51519918370818	2		x a t ə d͡z a n		
ты-джын	42.51519918370818	2		t ə d͡ʒ ə n		
хэткiи	63.772798775562265	3		x a t kʲ i j ə		
нэфэн	42.51519918370818	2		n a f a n		
'-ри	127.54559755112453	6		r ə j		
буквэ	42.51519918370818	2		bʷ ə k v a		
зэралъытэхэрэр	42.51519918370818	2		z a r aː ɬ ə t a x a r a r		
бгъэмысэхэ	42.51519918370818	2		b ʁ a m ə s a x a		
пшiоигъомэ	42.51519918370818	2		p ʃʷ a j ə ʁʷ a m a		
къэтхьыгъэ	42.51519918370818	2		q a t ħ ə ʁ a		
параграфым	42.51519918370818	2		p aː r aː ɡ r aː f ə m		
бгъэмысэнхэ	42.51519918370818	2		b ʁ a m ə s a n x a		
плъэкiыщтых	42.51519918370818	2		p ɬ a k j ə ɕ t ə x		
зэрипiырэм	42.51519918370818	2		z a r ə p j ə r a m		
нiыкiэри	42.51519918370818	2		n j ə kʲ j a r ə j		
къыгурыiуакiэри	42.51519918370818	2		q ə ɡʷ ə r ə j w aː kʲ j a r ə j		
иавторхэм	42.51519918370818	2		j aː v tʷ a r x a m		
къатыгъагъэм	42.51519918370818	2		q aː t ə ʁ aː ʁ a m		
щыхагъэунэфыкiыгъагъ	42.51519918370818	2		ɕ ə x aː ʁ a w n a f ə kʲ ə ʁ aː ʁ		
пычыгъо	85.03039836741635	4		p ə t͡ʃ ə ʁʷ a		
къызщитрэм	42.51519918370818	2		q ə ʃ ɕ ə t r a m		
щытэу	106.28799795927044	5		ɕ ə t a w		
птхын	42.51519918370818	2		p t x ə n		
еджагъэхэри	42.51519918370818	2		j a d͡ʒ aː ʁ a x a r ə j		
щыщхэри	42.51519918370818	2		ɕ ə ɕ x a r ə		
езэгъыгъэхэп	42.51519918370818	2		j a z a ʁ ə ʁ a x a p		
арти	85.03039836741635	4		aː r t ə j		
джырэ	318.8639938778113	15		d͡ʒ ə r a		d͡ʒ ə r a
хэмытыжьэу	42.51519918370818	2		x a m ə t ə ʑ a w		
къатыгъ	42.51519918370818	2		q aː t ə ʁ		
щыкiагъэу	42.51519918370818	2		ɕ ə k j aː ʁ a w		
фелъэгъу	42.51519918370818	2		f a j ɬ a ʁʷ		
тишiошiыкiэ	42.51519918370818	2		t ə j ʃʷ a ʃ j ə kʲ a		
къыгъэпсы	42.51519918370818	2		q ə ʁ a p s ə		
ы-р	42.51519918370818	2		ə r		
птхынэу	42.51519918370818	2		p t x ə n a w		
ищыкiагъэп	42.51519918370818	2		j ə ɕ ə k j aː ʁ a p		
къэiуакiэу	85.03039836741635	4		q a j w aː kʲ a w		
арышъ	127.54559755112453	6		aː r ə ʂ		aː r ə ʂ
орфоэпием	42.51519918370818	2		w a r f a a p ə j a m		
иiоф	63.772798775562265	3		j ə ɥ a f		
ипшъэрылъэхэм	42.51519918370818	2		j ə p ʂ a r ə ɬ a x a m		
къахахьэрэп	42.51519918370818	2		q aː x aː ħ a r a p		
джащ	488.924790612644	23		d͡ʒ aː ɕ		
фэд	106.28799795927044	5		f a d		f a d
пiоми	42.51519918370818	2		p i w a m ə j		
гущыiэхэу	42.51519918370818	2		ɡʷ ə ɕ ə j a x a w		
ахьмэд	510.1823902044981	24		aː ħ m a d		
абу	276.34879469410316	13		aː bʷ		
асет	42.51519918370818	2		aː s a j t		
апэ	85.03039836741635	4		aː p a		aː p a
ибгъэуцонри	42.51519918370818	2		j ə b ʁ a w t͡sʷ a n r ə j		
юныс	63.772798775562265	3		j u n ə s		
юсыф-мэ	42.51519918370818	2		j ʊ s ə f m a		
ачiыпiэ	85.03039836741635	4		aː t͡ʃ j ə p j a		
иуныс	42.51519918370818	2		j ə w n ə s		
иусыф	42.51519918370818	2		j ə w s ə f		
къызэрыщатырэр	42.51519918370818	2		q ə z a r ə ɕ aː t ə r a r		
зэрыхэхьагъэу	42.51519918370818	2		z a r ə x a ħ aː ʁ a w		
зэлъаштагъэу	42.51519918370818	2		z a ɬ aː ʃ t aː ʁ a w		
уцугъэхэр	42.51519918370818	2		w ə t͡sʷ ə ʁ a x a r		
зэпырыбгъэзэжьынхэр	42.51519918370818	2		z a p ə r ə b ʁ a z a ʑ ə n x a r		
ищыкiагъэхэп	42.51519918370818	2		j ə ɕ ə kʲ aː ʁ a x a p		
инджылыбзэми	42.51519918370818	2		j ə n d͡ʒ ə l ə b z a m ə		
нэпэмыкiыбзэми	42.51519918370818	2		n a p a m ə k j ə b z a m ə		
зэратхырэмрэ	85.03039836741635	4		z a r aː t x ə r a m r a		
яiэрэмкiэ	42.51519918370818	2		j a j a r a m kʲ j a		
зэтекiыхэу	42.51519918370818	2		z a t a j kʲ ə x a w		
боу	106.28799795927044	5		bʷ a w		
гущыiэхэр	127.54559755112453	6		ɡʷ ə ɕ ə j a x a r		
къыхэфэх	42.51519918370818	2		q ə x a f a x		
бзэхэр	127.54559755112453	6		b z a x a r		
зэшiуахыным	42.51519918370818	2		z a ʃʷ aː x ə n ə m		
агъэфедэнхэм	42.51519918370818	2		aː ʁ a f a j d a n x a m		
изэрар	42.51519918370818	2		j ə z a r aː r		
къакiорэп	42.51519918370818	2		q aː kʷʷ a r a p		
шъыпкъэ	85.03039836741635	4		ʂ ə p q a		ʂ ə p q a
щыiэх	106.28799795927044	5		ɕ ə j a x		
зырызхэр	85.03039836741635	4		z ə r ə z x a r		
къызэраiорэмрэ	42.51519918370818	2		q ə z a r a j w a r a m r a		
зэтефэхэу	42.51519918370818	2		z a t a j f a x a w		
грузинабзэр	42.51519918370818	2		ɡ rʷ ə z ə j n aː b z a r		
инэкiубгъохэм	42.51519918370818	2		j ə n a kʷ ə b ʁʷ a x a m		
iофыгъохэр	42.51519918370818	2		j a f ə ʁʷ a x a r		
ащызэшiопхыныр	42.51519918370818	2		aː ɕ ə z a ʃʷ a p x ə n ə r		
къинэу	42.51519918370818	2		q ə j n a w		
тыкъызтегущыiэмэ	42.51519918370818	2		t ə q ə z t a j ɡʷ ə ɕ ə j a m a		
тшiоигъор	42.51519918370818	2		t͡ʃ ʃʷ a j ə ʁʷ a r		
сыкъызыщыуцумэ	42.51519918370818	2		s ə q ə z ə ɕ ə w t͡sʷ ə m a		
сшiоигъор	42.51519918370818	2		ʃ ʃʷ a j ə ʁʷ a r		
хъокiо	85.03039836741635	4		χʷ a k ɥ a		
аслъан	340.1215934696654	16		aː s ɬ aː n		ʔ a s ɬ aː n
титхабзэ	42.51519918370818	2		t ə j t x aː b z a		
орэкъабзэ	42.51519918370818	2		w a r a q aː b z a		
июлым	42.51519918370818	2		j u l ə m		
авторыр	42.51519918370818	2		aː w t a r ə r		
техническэ	42.51519918370818	2		t a j x n ə j t͡ʃ a j s k a		
шiэныгъэхэмкiэ	255.09119510224906	12		ʃ j a n ə ʁ a x a m kʲ a		
кандидат	255.09119510224906	12		k aː n d ə j d aː t		
дэхэкiаеу	42.51519918370818	2		d a x a k j aː j a w		
алъэплъэ	42.51519918370818	2		aː ɬ a p ɬ a		
шiыгъэным	63.772798775562265	3		ʃ ə ʁ a n ə m		
ыгукiэ	127.54559755112453	6		ə ɡʷ ə kʲ j a		
егъапэ	42.51519918370818	2		j a ʁ aː p a		
щытхъоу	42.51519918370818	2		ɕ ə t χʷ a w		
фэлъэгъугъэн	42.51519918370818	2		f a ɬ a ʁʷ ə ʁ a n		
згъэгумэкiэу	42.51519918370818	2		z ʁ a ɡʷ ə m a kʲ a w		
хигъэунэфыкiырэр	42.51519918370818	2		x ə ʁ a w n a f ə kʲ ə r a r		
нэпэмыкiыбзэмэ	42.51519918370818	2		n a p a m ə kʲ ə b z a m a		
къахэкiхи	42.51519918370818	2		q aː x a kʲ i x ə		
къыхэхьагъэ	42.51519918370818	2		q ə x a ħ aː ʁ a		
гущыiэхэм	42.51519918370818	2		ɡʷ ə ɕ ə j a x a m		
ятхыкi	42.51519918370818	2		j aː t x ə k i		
iофыгъошхоу	42.51519918370818	2		j a f ə ʁʷ a ʃ xʷ a w		
лъэныкъор	85.03039836741635	4		ɬ a n ə qʷ a r		
къыдамылъытагъэу	42.51519918370818	2		q ə d aː m ə ɬ ə t aː ʁ a w		
зэритхырэр	42.51519918370818	2		z a r ə j t x ə r a r		
къыдамылъытагъэмэ	42.51519918370818	2		q ə d aː m ə ɬ ə t aː ʁ a m a		
парагрэфэу	42.51519918370818	2		p aː r aː ɡ r a f a w		
къышiхэрэм	42.51519918370818	2		q ə ʃ i x a r a m		
къащатхыныеп	42.51519918370818	2		q aː ɕ aː t x ə n ə j a p		
зэрэщытыр	85.03039836741635	4		z a r a ɕ ə t ə r		
ифэмэ-бжьымэхэр	42.51519918370818	2		j ə f a m a b ʑ ə m a x a r		
къытехьэхэзэ	42.51519918370818	2		q ə t a j ħ a x a z a		
кiэкiыкiэ	42.51519918370818	2		k j a k j ə kʲ j a		
уцугъэ	42.51519918370818	2		w ə t͡ʃʷ ə ʁ a		
къыхэкiэу	170.0607967348327	8		q ə x a kʲ j a w		
гущыiэхэри	42.51519918370818	2		ɡʷ ə ɕ ə j a x a r ə		
зырызхэри	85.03039836741635	4		z ə r ə z x a r ə		
зэпхыгъэ	42.51519918370818	2		z a p x ə ʁ a		
хьэзэрхэри	42.51519918370818	2		ħ a z a r x a r ə j		
къыхэхьагъэх	42.51519918370818	2		q ə x a ħ aː ʁ a x		
ясагъэх	42.51519918370818	2		j aː s aː ʁ a x		
хэтхэм	85.03039836741635	4		x a t x a m		
агъэкiодынкiэ	42.51519918370818	2		aː ʁ a kʷ a d ə n t͡ʃ a		
щыiэп	106.28799795927044	5		ɕ ə j a p		
пстэуми	63.772798775562265	3		p s t a w m ə j		
агъэфедэх	42.51519918370818	2		aː ʁ a f a j d a x		
грамматикэм	42.51519918370818	2		ɡ r aː m aː t ə j k a m		
щыщым	42.51519918370818	2		ɕ ə ɕ ə m		
егъэпсых	42.51519918370818	2		j a ʁ a p s ə x		
титхылъыбзэ	42.51519918370818	2		t ə j t x ə ɬ ə b z a		
уцу	42.51519918370818	2		w ə t͡ʃʷ ə		
тхакiохэм	85.03039836741635	4		t x aː kʷ a x a m		
къахэкiыщтгъэх	42.51519918370818	2		q aː x a k j ə ɕ t ʁ a x		
пстэури	127.54559755112453	6		p s t a w r ə j		
къэiогъэн	63.772798775562265	3		q a j w a ʁ a n		
зыiощтгъэхэр	42.51519918370818	2		z ə j w a ɕ t ʁ a x a r		
цiыфми	42.51519918370818	2		t͡s i ə f m ə j		
аштагъэп	42.51519918370818	2		aː ʃ t aː ʁ a p		
ибзэ	42.51519918370818	2		j ə b z a		
атетэу	63.772798775562265	3		aː t a j t a w		
хэхъоныгъэ	42.51519918370818	2		x a χʷ a n ə ʁ a		
лексикэмкiэ	42.51519918370818	2		l a j k s ə j k a m kʲ a		
ишiоигъоныгъэкiэ	42.51519918370818	2		j ə ʃʷ a j ə ʁʷ a n ə ʁ a kʲ a		
искусственэ	42.51519918370818	2		j ə s kʷ ə s t v a j n a		
зыфаiорэм	42.51519918370818	2		z ə f aː j w a r a m		
бгъэпсын	42.51519918370818	2		b ʁ a p s ə n		
ишапхъэхэр	42.51519918370818	2		j ə ʃ aː p χ a x a r		
зэблэтхъуным	42.51519918370818	2		z a b l a t χʷ ə n ə m		
тыпышъумыгъэлъэу	42.51519918370818	2		t ə p ə ʃʷ m ə ʁ a ɬ a w		
щыiэм	63.772798775562265	3		ɕ ə j a m		
тэрэзэу	85.03039836741635	4		t a r a z a w		
тырыжъугъэлажь	42.51519918370818	2		t ə r ə ʐʷ ə ʁ a l aː ʑ		
андырхъое	170.0607967348327	8		aː n d ə r χʷ a j a		
хъусен	255.09119510224906	12		χʷ ə s a j n		
бэгъ	148.8031971429786	7		b a ʁ		
нурбый	212.57599591854088	10		n ə w r b ə j		
бэрэтэрэ	42.51519918370818	2		b a r a t a r a		
хьамид	42.51519918370818	2		ħ aː m ə d		
жэнэ	63.772798775562265	3		ʒ a n a		
къырымыз	63.772798775562265	3		q ə r ə m ə z		
кощбэе	85.03039836741635	4		kʷ a ɕ b a j a		
пщымаф	63.772798775562265	3		p ɕ ə m aː f		
къоджэ	191.31839632668678	9		qʷ a d͡ʒ a		
къуекъо	127.54559755112453	6		qʷ a j qʷ a		
налбый	191.31839632668678	9		n aː l b ə j		
къумпiыл	42.51519918370818	2		qʷ ə m p j ə l		
тембот	63.772798775562265	3		t a j m bʷ a t		
кiэсэбэжъ	42.51519918370818	2		k j a s a b a ʐ		
къэплъан	127.54559755112453	6		q a p ɬ aː n		q a p ɬ aː n
кiубэ	85.03039836741635	4		k i w b a		
щэбан	42.51519918370818	2		ɕ a b aː n		
мэрэтыкъо	127.54559755112453	6		m a r a t ə qʷ a		
нэхэе	42.51519918370818	2		n a x a j a		
руслъан	63.772798775562265	3		rʷ ə s ɬ aː n		
пэнэшъу	42.51519918370818	2		p a n a ʂʷ		
мурат	85.03039836741635	4		m ə w r aː t		
теуцожь	446.40959142893587	21		t a j w t͡sʷ a ʑ		
цыгъу	42.51519918370818	2		t͡s ə ʁʷ		
саид	233.83359551039496	11		s aː j ə d		
аскэр	765.2735853067471	36		aː s k a r		
хьакурынэ	42.51519918370818	2		ħ aː kʷ ə r ə n a		
хьаткъо	63.772798775562265	3		ħ aː t qʷ a		
цэй	127.54559755112453	6		t͡s a j		
цуекъо	42.51519918370818	2		t͡sʷ ə j a qʷ a		
хьазрэт	148.8031971429786	7		ħ aː z r a t		
шапсыгъабзэ	42.51519918370818	2		ʃ aː p s ə ʁ aː b z a		
adyghe	106.28799795927044	5		a d ə ɡ ə		
музэейм	85.03039836741635	4		m ə z a j a j m		
къкӏэнгъэ	42.51519918370818	2		q t͡ʃʼ a n ʁ a		
центр	42.51519918370818	2		t͡s a j n t r		
цыф	63.772798775562265	3		t͡s ə f		
адыгъэхэмэ	42.51519918370818	2		aː d ə ʁ a x a m a		
кфар	531.4399897963522	25		k f aː r		
кама	85.03039836741635	4		k aː m aː		
дэт	1275.4559755112452	60		d a t		
адыгъэ	297.6063942859572	14		aː d ə ʁ a		
музей	85.03039836741635	4		m ə z a j		
музейм	42.51519918370818	2		m ə z a j m		
тхьэухъэ	42.51519918370818	2		t ħ a w χ a		
камэ	42.51519918370818	2		k aː m a		
дэтым	42.51519918370818	2		d a t ə m		
кърегъэблагъэх	42.51519918370818	2		q r a j ʁ a b ɮ aː ʁ a x		
лъэпкъэм	42.51519918370818	2		ɬ a p q a m		
тхыдэ	85.03039836741635	4		t x ə d a		t x ə d a
минрэ	212.57599591854088	10		m ə j n r a		
пчагъэ	42.51519918370818	2		p t͡ʃ aː ʁ a		
гуы	106.28799795927044	5		ɡʷ ə		
дунаеэм	42.51519918370818	2		dʷ ə n aː j a m		
къэнагъэх	42.51519918370818	2		q a n aː ʁ a x		
янэхьыжы	42.51519918370818	2		j aː n a ħ ə ʒ ə		
уынэ	63.772798775562265	3		w ə n a		
уынэр	42.51519918370818	2		w ə n a r		
паи	42.51519918370818	2		p aː j ə		
апэм	42.51519918370818	2		aː p a m		
фэду	85.03039836741635	4		f a dʷ		
пытэ	148.8031971429786	7		p ə t a		p ə t a
зэкӏэ	361.3791930615195	17		z a t͡ʃʼ a		z a t͡ʃʼ a
непэ	552.6975893882063	26		n a j p a		n a j p a
мэкъамэ	42.51519918370818	2		m a q aː m a		m a q aː m a
янэхь	63.772798775562265	3		j aː n a ħ		j aː n a ħ
аш	63.772798775562265	3		aː ʃ		
thumb	658.9855873474767	31		t ɛ m b		
нып	2614.684749798053	123		n ə p		n ə p
бракъ	63.772798775562265	3		b r aː q		
адыгеим	510.1823902044981	24		aː d ə ɡ a j ə m		
гъэм	1084.1375791845585	51		ʁ a m		
мафэр	42.51519918370818	2		m aː f a r		
ныпым	191.31839632668678	9		n ə p ə m		
мафэу	63.772798775562265	3		m aː f a w		
дышъэ	127.54559755112453	6		d ə ʂ a		d ə ʂ a
жъуагъо	148.8031971429786	7		ʐʷ aː ʁʷ a		ʒʷ aː ʁʷ a
тетым	42.51519918370818	2		t a j t ə m		
хэкур	106.28799795927044	5		x a kʷ ə r		
джоуэ	106.28799795927044	5		d͡ʒʷ a w a		
пэмыкӏ	106.28799795927044	5		p a m ə t͡ʃʼ		
лъэпшъ	42.51519918370818	2		ɬ a p ʂ		
цӏэкӏэ	63.772798775562265	3		t͡sʼ a t͡ʃʼ a		
дин	148.8031971429786	7		d ə j ə n		
уркуарт	42.51519918370818	2		w ə r kʷ aː r t		
дэвид	63.772798775562265	3		d a v ə j ə d		
ныпыр	85.03039836741635	4		n ə p ə r		
етӏуанэ	85.03039836741635	4		j a tʷʼ aː n a		j a tʷʼ aː n a
езы	191.31839632668678	9		j a z ə		
уркуартым	42.51519918370818	2		w ə r kʷ aː r t ə m		
xix	85.03039836741635	4		s i k s		
урыс-адыгэ	63.772798775562265	3		w r ə s aː d ə ɡ a		
зауэм	63.772798775562265	3		z aː w a m		
лъэш	42.51519918370818	2		ɬ a ʃ		ɬ a ʃ
абым	191.31839632668678	9		aː b ə m		
шъхьэкӏэ	212.57599591854088	10		ʂ ħ a t͡ʃʼ a		
британием	127.54559755112453	6		b r ə j t aː n ə j a m		
гугъэ	42.51519918370818	2		ɡʷ ə ʁ a		ɡʷ ə ʁ a
хъыбархэр	425.15199183708177	20		χ ə b aː r x a r		
сайтыр	85.03039836741635	4		s aː j t ə r		
къэрэшей-шэрджэсым	42.51519918370818	2		q a r a ʃ a j ʃ a r d͡ʒ a s ə m		
сайт	170.0607967348327	8		s aː j t		
теухуа	63.772798775562265	3		t a j w xʷ aː		
къэрал	2040.7295608179925	96		q a r aː l		q a r aː ɮ
file	595.2127885719144	28		f a j l ə		
автор	42.51519918370818	2		aː w tʷ a r		
мэщбэшӏэ	127.54559755112453	6		m a ɕ b a ʃʼ a		
композитор	42.51519918370818	2		kʷ a m p a z ə j t ə r		
тихэгъэгу	63.772798775562265	3		t ə j x a ʁ a ɡʷ		
лъэпкъыбэр	42.51519918370818	2		ɬ a p q ə b a r		
'жъыу	85.03039836741635	4		ʐ ə w		
республикэу	765.2735853067471	36		r a j s pʷ ə b l ə j k a w		
дах	42.51519918370818	2		d aː x		
россием	42.51519918370818	2		rʷ a s ə j a m		
зыкӏэ	42.51519918370818	2		z ə t͡ʃʼ a		
aseu	42.51519918370818	2		a s øː		
ch	63.772798775562265	3		t͡ʃ		
zy	42.51519918370818	2		z iː		
'rzyu	85.03039836741635	4		r z i w		
sh	63.772798775562265	3		ʃ		
u	148.8031971429786	7		uː		
uat	42.51519918370818	2		w a t		
riespublikeu	42.51519918370818	2		r i s p u b l i k øː		
te	42.51519918370818	2		t eː		
escht	42.51519918370818	2		eː ʃ t		
гимн	148.8031971429786	7		ɡ ə j m ə n		
youtube	42.51519918370818	2		j u t y b ə		
адыгэхэр	658.9855873474767	31		aː d ə ɣ a x a r		
пстэур	63.772798775562265	3		p s t a w ə r		
зэрысыгъэ	42.51519918370818	2		z a r ə s ə ʁ a		
краснодар	701.5007865311849	33		k r aː s nʷ a d aː r		
шапсыгъэ	425.15199183708177	20		ʃ aː p s ə ʁ a		
ыпычыгъу	42.51519918370818	2		ə p ə t͡ʃ ə ʁʷ		
къэбэртэе-балъкъэр	148.8031971429786	7		q a b a r t a j a b aː ɬ q a r		
google	63.772798775562265	3		ɡ u ɡ l ə		
maps	63.772798775562265	3		m a p s		
псы	170.0607967348327	8		p s ə		p s ə
бгы	63.772798775562265	3		b ɣ ə		b ɣ ə
алъапс	42.51519918370818	2		aː ɬ aː p s		
алфавитэу	42.51519918370818	2		aː ɬ f aː v ə j t a w		
зэхигъэуцуа-гъэм	42.51519918370818	2		z a x ə ʁ a w t͡sʷ aː ʁ a m		
начальные	42.51519918370818	2		n aː t͡ʃ aː lʲ n ə j a		
правила	42.51519918370818	2		p r aː v ə j ɮ aː		
адыгейской	42.51519918370818	2		aː d ə ɡ a j s kʷ a j		
черкесские	42.51519918370818	2		t͡ʃ a j r k a j s k ə j a		
предания	42.51519918370818	2		p r a j d aː n ə j j a		
история	42.51519918370818	2		j ə s tʷ a r ə j j a		
адыгейского	42.51519918370818	2		aː d ə ɡ a j s kʷ a ɡʷ a		
народа	63.772798775562265	3		n aː rʷ a d aː		
зыфиiорэ	148.8031971429786	7		z ə f ə j j ə w a r a		
тхыгъэшхохэу	42.51519918370818	2		t x ə ʁ a ʃ xʷ a x a w		
нэгумэм	148.8031971429786	7		n a ɡʷ ə m a m		
ышiыгъэхэм	42.51519918370818	2		ə ʃ j ə ʁ a x a m		
иморадхэр	42.51519918370818	2		j ə mʷ a r aː d x a r		
къыдэхъуныр	42.51519918370818	2		q ə d a χʷ ə n ə r		
инасыпы	42.51519918370818	2		j ə n aː s ə p ə		
къыхьыгъэп	42.51519918370818	2		q ə ħ ə ʁ a p		
итхыгъэхэр	85.03039836741635	4		j ə t x ə ʁ a x a r		
